{
  "schemaVersion": 1,
  "bundleId": "demo-bundle-2026-08-02",
  "generatedAt": "2026-08-02T21:15:00.000Z",
  "producer": {
    "agent": "fixture-generator",
    "skill": "demo-data",
    "version": "1"
  },
  "upserts": {
    "topics": [
      {
        "id": "topic-demo-efficient-ml",
        "name": "Efficient adaptive models",
        "slug": "efficient-adaptive-models",
        "description": "Illustrative topic for validating the console.",
        "domains": ["Artificial intelligence", "Machine learning"],
        "status": "active",
        "updatedAt": "2026-08-02T21:15:00.000Z"
      },
      {
        "id": "topic-demo-quantum-sensing",
        "name": "Room-temperature quantum sensing",
        "slug": "room-temperature-quantum-sensing",
        "description": "Illustrative physics topic for validating cross-domain organization.",
        "domains": ["Physics", "Quantum sensing"],
        "status": "active",
        "updatedAt": "2026-08-02T20:45:00.000Z"
      },
      {
        "id": "topic-demo-agent-memory",
        "name": "Long-horizon agent memory",
        "slug": "long-horizon-agent-memory",
        "description": "Illustrative agent-systems topic.",
        "domains": ["Artificial intelligence", "Software systems"],
        "status": "paused",
        "updatedAt": "2026-08-01T19:00:00.000Z"
      }
    ],
    "runs": [
      {
        "id": "run-demo-001",
        "topicId": "topic-demo-efficient-ml",
        "skill": "paper-opportunity-radar",
        "status": "completed",
        "title": "[Demo] Adaptive sparsity daily sweep",
        "summary": "Illustrative run that audited three candidate papers, reproduced one bounded claim, and promoted one narrow tooling opportunity.",
        "scope": "Demo-only corpus bounded to two indexes, one archive band, and a follow-up graph for adaptive sparse inference.",
        "startedAt": "2026-08-02T18:00:00.000Z",
        "completedAt": "2026-08-02T20:20:00.000Z",
        "coverage": {
          "recordsReturned": 148,
          "recordsNew": 31,
          "recordsDeduplicated": 117,
          "recordsScreened": 46,
          "fullTextsAccessed": 8,
          "papersAudited": 3,
          "baselineStatus": "BASELINE IN PROGRESS",
          "nextCursor": "OpenAlex / 2018-2020 / page 4",
          "blindSpots": ["Patent-family search is incomplete", "Two supplements were unavailable"]
        },
        "reportIds": ["report-demo-radar"],
        "updatedAt": "2026-08-02T20:20:00.000Z"
      },
      {
        "id": "run-demo-002",
        "topicId": "topic-demo-quantum-sensing",
        "skill": "lead-research",
        "status": "completed",
        "title": "[Demo] Quantum sensing landscape",
        "summary": "Illustrative research program mapping mechanisms, enabling hardware, and disputed performance boundaries.",
        "startedAt": "2026-08-01T14:00:00.000Z",
        "completedAt": "2026-08-01T18:15:00.000Z",
        "reportIds": ["report-demo-landscape"],
        "updatedAt": "2026-08-01T18:15:00.000Z"
      },
      {
        "id": "run-demo-003",
        "topicId": "topic-demo-agent-memory",
        "skill": "validate-market",
        "status": "partial",
        "title": "[Demo] Agent memory market validation",
        "summary": "Illustrative market-validation pass; buyer evidence remains incomplete and the opportunity stays in test.",
        "startedAt": "2026-07-31T16:00:00.000Z",
        "completedAt": "2026-07-31T17:40:00.000Z",
        "reportIds": ["report-demo-market", "report-demo-learning"],
        "updatedAt": "2026-07-31T17:40:00.000Z"
      }
    ],
    "papers": [
      {
        "id": "paper-demo-001",
        "topicId": "topic-demo-efficient-ml",
        "runId": "run-demo-001",
        "title": "[Demo] Conditional sparsity under bounded distribution shift",
        "authors": ["A. Example", "B. Example", "C. Example"],
        "year": 2024,
        "venue": "Illustrative Systems Conference",
        "canonicalUrl": "https://example.com/papers/conditional-sparsity",
        "identifiers": { "demo": "paper-001" },
        "abstract": "Synthetic fixture content used to exercise the paper audit interface.",
        "domains": ["Machine learning", "Software systems"],
        "tags": ["demo", "sparsity", "distribution shift"],
        "verdict": "PROMISING - UNREPLICATED",
        "evidenceScore": 3,
        "evidenceSummary": "In this illustrative record, the narrow latency claim reproduced within tolerance, while generalization beyond the reported shift remains untested.",
        "selectionReason": "The reported gain was specific, testable, and potentially enabled by cheaper edge inference.",
        "authorsClaim": "The authors report stable accuracy with materially lower conditional compute under one bounded shift family.",
        "evidenceSupports": "The fixture audit supports only the reported benchmark and shift family, not broad robustness.",
        "strongestEvidence": "A seed-controlled rerun landed within one percentage point of the reported accuracy and reproduced the compute reduction.",
        "strongestCounterevidence": "No independent group or unseen shift family is available in this fixture.",
        "integrityStatus": "No correction or formal integrity notice appears in the illustrative record.",
        "replicationStatus": "One internal sandbox reproduction; independent replication is unknown.",
        "decisiveNextCheck": "Evaluate the gating policy on a temporally separated dataset with a fixed compute budget.",
        "dossierMarkdown": "## Scoped verdict\n\nThis is **demo data**, not a claim about a real paper. The interface keeps the author claim separate from what the sandbox run directly supports.\n\n## Claim-to-evidence table\n\n| Claim | Evidence | Boundary | Status |\n| --- | --- | --- | --- |\n| Accuracy is retained | Seed-controlled rerun | One synthetic shift family | Single-origin support |\n| Compute is reduced | Operation count artifact | Same implementation | Reproduced |\n| Robustness generalizes | No evidence attached | Unseen shifts | Unknown |\n\n## Reproducibility\n\nThe attempt used an offline container, a fixed seed, a pinned image digest, and immutable evidence hashes.",
        "opportunityIds": ["opportunity-demo-001"],
        "experimentIds": ["experiment-demo-001"],
        "sourceIds": ["source-demo-paper-001", "source-demo-followup-001"],
        "discoveredAt": "2026-08-02T18:22:00.000Z",
        "auditedAt": "2026-08-02T20:05:00.000Z",
        "updatedAt": "2026-08-02T20:05:00.000Z"
      },
      {
        "id": "paper-demo-002",
        "topicId": "topic-demo-efficient-ml",
        "runId": "run-demo-001",
        "title": "[Demo] Reusable routing policies for low-power inference",
        "authors": ["D. Example", "E. Example"],
        "year": 2022,
        "venue": "Illustrative ML Workshop",
        "canonicalUrl": "https://example.com/papers/reusable-routing",
        "domains": ["Artificial intelligence", "Machine learning"],
        "tags": ["demo", "edge inference"],
        "verdict": "MIXED OR FRAGILE",
        "evidenceScore": 2,
        "evidenceSummary": "The example audit found a real signal, but gains collapsed under compute-matched baselines and seed variance was not bounded.",
        "selectionReason": "The work is under-cited and proposes a reusable component rather than a full product.",
        "authorsClaim": "A learned router transfers across model families without retuning.",
        "evidenceSupports": "Transfer is visible for two related models, with weak baseline parity.",
        "strongestEvidence": "Ablations isolate the routing component on the primary benchmark.",
        "strongestCounterevidence": "Compute-matched baselines recover most of the stated improvement.",
        "integrityStatus": "No formal notice is represented in this demo.",
        "replicationStatus": "No independent reproduction is represented.",
        "decisiveNextCheck": "Rerun with compute-matched baselines and five prespecified seeds.",
        "sourceIds": ["source-demo-paper-002"],
        "discoveredAt": "2026-08-02T18:32:00.000Z",
        "auditedAt": "2026-08-02T19:40:00.000Z",
        "updatedAt": "2026-08-02T19:40:00.000Z"
      },
      {
        "id": "paper-demo-003",
        "topicId": "topic-demo-quantum-sensing",
        "runId": "run-demo-002",
        "title": "[Demo] Ambient-field calibration in compact spin sensors",
        "authors": ["F. Example", "G. Example"],
        "year": 2019,
        "venue": "Illustrative Applied Physics Journal",
        "canonicalUrl": "https://example.com/papers/ambient-calibration",
        "domains": ["Physics", "Quantum sensing"],
        "tags": ["demo", "calibration", "sensors"],
        "verdict": "SUBSTANTIATED",
        "evidenceScore": 4,
        "evidenceSummary": "The illustrative calibration mechanism has transparent methods and convergent support from two independent-origin records.",
        "selectionReason": "An older method may now be practical because control electronics are cheaper and smaller.",
        "authorsClaim": "A reference sequence removes a dominant ambient-field error without cryogenic control.",
        "evidenceSupports": "The calibration effect persists across the documented temperature and field range.",
        "strongestEvidence": "Two independent-origin examples converge on the same error-cancellation mechanism.",
        "strongestCounterevidence": "Long-duration drift outside the reported operating range remains unknown.",
        "integrityStatus": "No correction or formal notice is represented in this demo.",
        "replicationStatus": "Independent convergent support is represented for the bounded mechanism.",
        "decisiveNextCheck": "Run a 30-day drift test in a target deployment enclosure.",
        "opportunityIds": ["opportunity-demo-002"],
        "sourceIds": ["source-demo-paper-003"],
        "discoveredAt": "2026-08-01T14:25:00.000Z",